00:00.0 Class [0600]: Device [8086:1237] (rev 02)
	Subsystem: Device [1af4:1100]
	Control: I/O+ Mem+ BusMaster+ SpecCycle- MemWINV- VGASnoop- ParErr- Stepping- SERR- FastB2B- DisINTx-
	Status: Cap- 66MHz- UDF- FastB2B- ParErr- DEVSEL=fast >TAbort- <TAbort- <MAbort- >SERR- <PERR- INTx-
	Latency: 0

00:01.0 Class [0601]: Device [8086:7000]
	Subsystem: Device [1af4:1100]
	Control: I/O+ Mem+ BusMaster+ SpecCycle- MemWINV- VGASnoop- ParErr- Stepping- SERR- FastB2B- DisINTx-
	Status: Cap- 66MHz- UDF- FastB2B- ParErr- DEVSEL=medium >TAbort- <TAbort- <MAbort- >SERR- <PERR- INTx-
	Latency: 0

00:01.1 Class [0101]: Device [8086:7010] (prog-if 80 [Master])
	Subsystem: Device [1af4:1100]
	Control: I/O+ Mem+ BusMaster+ SpecCycle- MemWINV- VGASnoop- ParErr- Stepping- SERR- FastB2B- DisINTx-
	Status: Cap- 66MHz- UDF- FastB2B+ ParErr- DEVSEL=medium >TAbort- <TAbort- <MAbort- >SERR- <PERR- INTx-
	Latency: 0
	Region 0: [virtual] Memory at 000001f0 (32-bit, non-prefetchable) [size=8]
	Region 1: [virtual] Memory at 000003f0 (type 3, non-prefetchable) [size=1]
	Region 2: [virtual] Memory at 00000170 (32-bit, non-prefetchable) [size=8]
	Region 3: [virtual] Memory at 00000370 (type 3, non-prefetchable) [size=1]
	Region 4: I/O ports at c080 [size=16]
	Kernel driver in use: ata_piix

00:01.2 Class [0c03]: Device [8086:7020] (rev 01)
	Subsystem: Device [1af4:1100]
	Control: I/O+ Mem+ BusMaster+ SpecCycle- MemWINV- VGASnoop- ParErr- Stepping- SERR- FastB2B- DisINTx-
	Status: Cap- 66MHz- UDF- FastB2B- ParErr- DEVSEL=fast >TAbort- <TAbort- <MAbort- >SERR- <PERR- INTx-
	Latency: 0
	Interrupt: pin D routed to IRQ 11
	Region 4: I/O ports at c060 [size=32]
	Kernel driver in use: uhci_hcd

00:01.3 Class [0680]: Device [8086:7113] (rev 03)
	Subsystem: Device [1af4:1100]
	Control: I/O+ Mem+ BusMaster+ SpecCycle- MemWINV- VGASnoop- ParErr- Stepping- SERR- FastB2B- DisINTx-
	Status: Cap- 66MHz- UDF- FastB2B+ ParErr- DEVSEL=medium >TAbort- <TAbort- <MAbort- >SERR- <PERR- INTx-
	Latency: 0
	Interrupt: pin A routed to IRQ 9

00:02.0 Class [0300]: Device [1b36:0100] (rev 05)
	Subsystem: Device [1af4:1100]
	Control: I/O+ Mem+ BusMaster+ SpecCycle- MemWINV- VGASnoop- ParErr- Stepping- SERR- FastB2B- DisINTx-
	Status: Cap- 66MHz- UDF- FastB2B- ParErr- DEVSEL=fast >TAbort- <TAbort- <MAbort- >SERR- <PERR- INTx-
	Latency: 0
	Interrupt: pin A routed to IRQ 10
	Region 0: Memory at 84000000 (32-bit, non-prefetchable) [size=64M]
	Region 1: Memory at 80000000 (32-bit, non-prefetchable) [size=64M]
	Region 2: Memory at 88060000 (32-bit, non-prefetchable) [size=8K]
	Region 3: I/O ports at c040 [size=32]
	Expansion ROM at 000c0000 [disabled] [size=128K]

00:03.0 Class [0200]: Device [8086:100e] (rev 03)
	Subsystem: Device [1af4:1100]
	Control: I/O+ Mem+ BusMaster+ SpecCycle- MemWINV- VGASnoop- ParErr- Stepping- SERR- FastB2B- DisINTx-
	Status: Cap- 66MHz- UDF- FastB2B- ParErr- DEVSEL=fast >TAbort- <TAbort- <MAbort- >SERR- <PERR- INTx-
	Latency: 0
	Interrupt: pin A routed to IRQ 10
	Region 0: Memory at 88040000 (32-bit, non-prefetchable) [size=128K]
	Region 1: I/O ports at c000 [size=64]
	Expansion ROM at 3e800000 [disabled] [size=256K]
	Kernel driver in use: e1000

